{
  "id": "https://www.metaconceptualart.com/movement#claim",
  "type": "MetaconceptualArtClaim",
  "label": "Metaconceptual Art as a linked-open-data movement claim",
  "definition": "Metaconceptual Art is a movement claim for art that treats art, its institutions, markets, archives, viewers, metadata, provenance, and meaning as the material of the work.",
  "genealogy": [
    {
      "label": "Conceptual art",
      "url": "https://www.wikidata.org/wiki/Q203209",
      "authority": "Wikidata",
      "role": "art-historical lineage"
    },
    {
      "label": "Institutional critique",
      "url": "https://www.wikidata.org/wiki/Q6041145",
      "authority": "Wikidata",
      "role": "institutional lineage"
    },
    {
      "label": "Systems art",
      "url": "https://www.wikidata.org/wiki/Q919251",
      "authority": "Wikidata",
      "role": "systems lineage"
    },
    {
      "label": "Internet art",
      "url": "https://www.wikidata.org/wiki/Q1569950",
      "authority": "Wikidata",
      "role": "networked art lineage"
    }
  ],
  "principles": [
    {
      "label": "Movement Record",
      "url": "https://www.metaconceptualart.com/movement",
      "authority": "local",
      "role": "human-readable argument"
    },
    {
      "label": "Metaconceptual Art profile",
      "url": "https://www.metaconceptualart.com/data/profile/metaconceptual-art-profile.jsonld",
      "authority": "local JSON-LD",
      "role": "machine-readable evidence profile"
    }
  ],
  "works": [
    {
      "label": "Eight Sentences On Metaconceptual Art",
      "url": "https://www.metaconceptualart.com/data/linked-art/eight-sentences",
      "authority": "Linked Art",
      "role": "proposition work"
    },
    {
      "label": "www.wtfisart.com",
      "url": "https://www.metaconceptualart.com/data/linked-art/wtfisart",
      "authority": "Linked Art",
      "role": "born-digital conceptual work"
    },
    {
      "label": "WTF is Ansel Adams",
      "url": "https://www.metaconceptualart.com/data/linked-art/wtf-is-ansel-adams",
      "authority": "Linked Art",
      "role": "conceptual work, related to www.wtfisart.com"
    },
    {
      "label": "Construction of the Museum as Concept",
      "url": "https://www.metaconceptualart.com/data/linked-art/construction-museum",
      "authority": "Linked Art",
      "role": "image work"
    },
    {
      "label": "Art Market Reform",
      "url": "https://www.metaconceptualart.com/data/linked-art/art-market-reform",
      "authority": "Linked Art",
      "role": "image work"
    },
    {
      "label": "Eightfold Sprocket",
      "url": "https://www.metaconceptualart.com/data/linked-art/eightfold-sprocket",
      "authority": "Linked Art",
      "role": "diagrammatic emblem"
    },
    {
      "label": "Movement Graph",
      "url": "https://www.metaconceptualart.com/data/linked-art/movement-graph",
      "authority": "Linked Art",
      "role": "site-native system work"
    },
    {
      "label": "Proof of Movement: Metaconceptual Art",
      "url": "https://www.metaconceptualart.com/data/linked-art/movement-record",
      "authority": "Linked Art",
      "role": "citable record"
    }
  ],
  "standards": [
    {
      "label": "Linked Art concept record",
      "url": "https://www.metaconceptualart.com/data/linked-art/concept-metaconceptual-art",
      "authority": "Linked Art",
      "role": "local movement concept"
    },
    {
      "label": "Knowledge graph",
      "url": "https://www.metaconceptualart.com/data/graph.json",
      "authority": "local JSON",
      "role": "graph evidence"
    },
    {
      "label": "IIIF manifest",
      "url": "https://www.metaconceptualart.com/data/iiif/construction-museum/manifest.json",
      "authority": "IIIF Presentation 3.0",
      "role": "image interoperability"
    },
    {
      "label": "Activity Stream",
      "url": "https://www.metaconceptualart.com/data/linked-art/activity-stream",
      "authority": "IIIF Discovery",
      "role": "change discovery"
    }
  ],
  "externalAuthorities": [
    {
      "label": "Semantic Web",
      "url": "https://www.wikidata.org/wiki/Q54837",
      "authority": "Wikidata",
      "role": "technical lineage"
    },
    {
      "label": "Linked open data",
      "url": "https://www.wikidata.org/wiki/Q18692990",
      "authority": "Wikidata",
      "role": "evidence medium"
    },
    {
      "label": "Provenance",
      "url": "https://vocab.getty.edu/page/aat/300055863",
      "authority": "Getty AAT",
      "role": "provenance concept"
    }
  ],
  "provenance": [
    {
      "label": "Sun & Rain Works established",
      "url": "https://www.metaconceptualart.com/data/linked-art/sun-and-rain-works",
      "authority": "Linked Art",
      "role": "2005 studio and art-business formation"
    },
    {
      "label": "Metaconceptual Art origin provenance",
      "url": "https://www.metaconceptualart.com/data/profile/metaconceptual-art-origin-provenance.json",
      "authority": "local JSON",
      "role": "origin chronology: 2005 studio, 2007 movement, 2009 early-work evidence, 2026 linked-data publication"
    },
    {
      "label": "Changelog",
      "url": "https://www.metaconceptualart.com/changelog",
      "authority": "local",
      "role": "visible revision history"
    },
    {
      "label": "Publication provenance",
      "url": "https://www.metaconceptualart.com/data/linked-art/provenance-publication",
      "authority": "Linked Art",
      "role": "publication activity"
    },
    {
      "label": "Software Heritage archive of the revision history",
      "url": "https://archive.softwareheritage.org/swh:1:snp:93a00a523674d0320f05b783c35a22c43c6328a0",
      "authority": "Software Heritage",
      "role": "independent preservation of the git history the Activity Stream is derived from; snapshot of 2026-09-22, content-derived identifier swh:1:snp:93a00a523674d0320f05b783c35a22c43c6328a0"
    }
  ],
  "limitations": "This claim demonstrates internal coherence, standards-based legibility, external alignment, and a studio-origin chronology. It does not claim that Wikidata, Getty, museums, scholars, or other third-party authorities have already canonized Metaconceptual Art as an established historical movement. Earlier studio evidence may support priority for a related metaconceptual structure without proving direct influence on later artists or events unless separate evidence of access, contact, or derivation is published."
}
