{
  "id": "https://www.metaconceptualart.com/movement#claim",
  "type": "MetaconceptualArtClaim",
  "label": "Metaconceptual Art as a linked-open-data movement claim",
  "definition": "Metaconceptual Art is a movement claim for art that treats art, its institutions, markets, archives, viewers, metadata, provenance, and meaning as the material of the work.",
  "genealogy": [
    {
      "label": "Conceptual art",
      "url": "https://www.wikidata.org/wiki/Q203209",
      "authority": "Wikidata",
      "role": "art-historical lineage"
    },
    {
      "label": "Institutional critique",
      "url": "https://www.wikidata.org/wiki/Q6041145",
      "authority": "Wikidata",
      "role": "institutional lineage"
    },
    {
      "label": "Systems art",
      "url": "https://www.wikidata.org/wiki/Q919251",
      "authority": "Wikidata",
      "role": "systems lineage"
    }
  ],
  "principles": [
    {
      "label": "Movement Record",
      "url": "https://www.metaconceptualart.com/movement",
      "authority": "local",
      "role": "human-readable argument"
    }
  ],
  "works": [
    {
      "label": "Eight Sentences On Metaconceptual Art",
      "url": "https://www.metaconceptualart.com/data/linked-art/eight-sentences",
      "authority": "Linked Art",
      "role": "proposition work",
      "publicationStatus": "public"
    }
  ],
  "standards": [
    {
      "label": "Linked Art concept record",
      "url": "https://www.metaconceptualart.com/data/linked-art/concept-metaconceptual-art",
      "authority": "Linked Art",
      "role": "local movement concept"
    },
    {
      "label": "Knowledge graph",
      "url": "https://www.metaconceptualart.com/data/graph.json",
      "authority": "local JSON",
      "role": "graph evidence"
    },
    {
      "label": "Activity Stream",
      "url": "https://www.metaconceptualart.com/data/linked-art/activity-stream",
      "authority": "IIIF Discovery",
      "role": "change discovery"
    }
  ],
  "externalAuthorities": [
    {
      "label": "Semantic Web",
      "url": "https://www.wikidata.org/wiki/Q54837",
      "authority": "Wikidata",
      "role": "technical lineage"
    },
    {
      "label": "Linked open data",
      "url": "https://www.wikidata.org/wiki/Q18692990",
      "authority": "Wikidata",
      "role": "evidence medium"
    },
    {
      "label": "Provenance",
      "url": "https://vocab.getty.edu/page/aat/300055863",
      "authority": "Getty AAT",
      "role": "provenance concept"
    }
  ],
  "provenance": [
    {
      "label": "Changelog",
      "url": "https://www.metaconceptualart.com/changelog",
      "authority": "local",
      "role": "visible revision history"
    }
  ],
  "limitations": "This claim demonstrates internal coherence, standards-based legibility, and external alignment without asserting external canonization."
}
